sceptisch	褋泻械锌褌懈褔薪懈泄
gloednieuw	薪芯胁褨褋褨薪褜泻懈泄
aanvoelen	胁褨写褔褍胁邪褌懈, 胁谐邪写褍胁邪褌懈
de filosoof	褎褨谢芯褋芯褎
zwerven	斜谢褍泻邪褌懈, 锌芯薪械胁褨褉褟褌懈褋褟
het proefwerk	泻芯薪褌褉芯谢褜薪邪 褉芯斜芯褌邪
betoverend	褔邪褉褨胁薪懈泄, 蟹邪胁芯褉芯卸谢懈胁懈泄
pronken	褏懈蟹褍胁邪褌懈褋褟, 泻褉邪褋褍胁邪褌懈褋褟
zonnen	蟹邪褋屑邪谐邪褌懈
de havik	褟褋褌褉褍斜
onderwijzen	薪邪胁褔邪褌懈
kammen	褉芯蟹褔褨褋褍胁邪褌懈
onvindbaar	薪械胁褨写褕褍泻褍胁邪薪懈泄
bezetten	蟹邪泄屑邪褌懈, 芯泻褍锌褍胁邪褌懈
shoppen	褏芯写懈褌懈 锌芯 屑邪谐邪蟹懈薪邪褏
strategisch	褋褌褉邪褌械谐褨褔薪懈泄
onbruikbaar	薪械锌褉懈写邪褌薪懈泄
benadrukken	锌褨写泻褉械褋谢褞胁邪褌懈, 薪邪谐芯谢芯褕褍胁邪褌懈
snuiven	薪褞褏邪褌懈, 褕屑芯褉谐邪褌懈
nadoen	薪邪褋谢褨写褍胁邪褌懈, 泻芯锌褨褞胁邪褌懈
aannemelijk	锌褉邪胁写芯锌芯写褨斜薪懈泄
excellent	胁褨写屑褨薪薪懈泄
psychiatrisch	锌褋懈褏褨邪褌褉懈褔薪懈泄
exotisch	械泻蟹芯褌懈褔薪懈泄
louter	褋褍褌芯, 褋邪屑懈泄 谢懈褕械
zegevieren	褌褉褨褍屑褎褍胁邪褌懈
werven	胁械褉斜褍胁邪褌懈, 薪邪斜懈褉邪褌懈
het alfabet	邪斜械褌泻邪
commanderen	泻芯屑邪薪写褍胁邪褌懈
piepen	锌懈褖邪褌懈, 褋泻褉懈锌褨褌懈
vindingrijk	胁懈薪邪褏褨写谢懈胁懈泄
solliciteren	锌芯写邪胁邪褌懈 蟹邪褟胁泻褍 薪邪 褉芯斜芯褌褍
de sneeuwstorm	褏褍褉褌芯胁懈薪邪
de onderdrukking	谐薪芯斜谢械薪薪褟
uitzitten	胁褨写褋懈写褨褌懈 (褌械褉屑褨薪)
fokken	褉芯蟹胁芯写懈褌懈 (褌胁邪褉懈薪)
claimen	蟹邪褟胁谢褟褌懈 锌褉邪胁邪, 胁懈屑邪谐邪褌懈
drastisch	褉邪写懈泻邪谢褜薪懈泄, 褉褨蟹泻懈泄
regelrecht	锌褉褟屑褨褋褨薪褜泻芯, 胁褨写胁械褉褌芯
ijdel	屑邪褉薪芯褋谢邪胁薪懈泄, 锌褍褋褌懈泄
bloederig	泻褉懈胁邪胁懈泄
inladen	蟹邪胁邪薪褌邪卸褍胁邪褌懈
voordien	写芯 褌芯谐芯
unaniem	芯写薪芯褋褌邪泄薪懈泄
het perron	锌械褉芯薪
ontruimen	蟹胁褨谢褜薪褟褌懈, 械胁邪泻褍褞胁邪褌懈
vergaderen	蟹邪褋褨写邪褌懈, 蟹斜懈褉邪褌懈褋褟
verjagen	锌褉芯谐邪薪褟褌懈
de rechtsgang	褋褍写芯胁懈泄 锌褉芯褑械褋
kraaien	泻褍泻褍褉褨泻邪褌懈
invoeren	蟹邪锌褉芯胁邪写卸褍胁邪褌懈; 胁胁芯写懈褌懈
de trompet	褌褉褍斜邪 (褨薪褋褌褉褍屑械薪褌)
betreuren	褕泻芯写褍胁邪褌懈, 芯锌谢邪泻褍胁邪褌懈
eruitzien	胁懈谐谢褟写邪褌懈
waarnemen	褋锌褉懈泄屑邪褌懈, 褋锌芯褋褌械褉褨谐邪褌懈
onwettig	薪械蟹邪泻芯薪薪懈泄
inzoomen	薪邪斜谢懈卸邪褌懈 (蟹芯斜褉邪卸械薪薪褟)
achterstevoren	蟹邪写芯屑 薪邪锌械褉械写
keuren	锌械褉械胁褨褉褟褌懈, 芯褑褨薪褞胁邪褌懈
aanmelden	褉械褦褋褌褉褍胁邪褌懈褋褟, 蟹邪褟胁谢褟褌懈
vruchtbaar	褉芯写褞褔懈泄, 锌谢褨写薪懈泄
legendarisch	谢械谐械薪写邪褉薪懈泄
de zoo	蟹芯芯锌邪褉泻
de boeman	斜邪斜邪泄, 褋褌褉邪褏芯胁懈褋褜泻芯
zwart-wit	褔芯褉薪芯-斜褨谢懈泄
herrijzen	胁芯褋泻褉械褋邪褌懈, 胁褨写褉芯写卸褍胁邪褌懈褋褟
kansloos	斜械蟹薪邪写褨泄薪懈泄
tippen	写邪胁邪褌懈 锌褨写泻邪蟹泻褍
ongemerkt	薪械锌芯屑褨褌薪芯
het kader	褉邪屑泻邪; 泻邪写褉懈
achterhaald	蟹邪褋褌邪褉褨谢懈泄
het busstation	邪胁褌芯胁芯泻蟹邪谢
krimpen	褋褌懈褋泻邪褌懈褋褟, 蟹斜褨谐邪褌懈褋褟
mediteren	屑械写懈褌褍胁邪褌懈
bovenal	锌芯薪邪写 褍褋械
de tsunami	褑褍薪邪屑褨
de huisarts	褋褨屑械泄薪懈泄 谢褨泻邪褉
mijden	褍薪懈泻邪褌懈
picknicken	胁谢邪褕褌芯胁褍胁邪褌懈 锌褨泻薪褨泻
veronderstellen	锌褉懈锌褍褋泻邪褌懈
afbranden	蟹谐芯褉褟褌懈 写芯褖械薪褌褍
elektronisch	械谢械泻褌褉芯薪薪懈泄
mikken	褑褨谢懈褌懈褋褟
nice	泻谢邪褋薪懈泄, 锌褉懈褦屑薪懈泄
