stijlvol	褋褌懈谢褜薪懈泄
het regime	褉械卸懈屑
de slijm	褋谢懈蟹
de bakkerij	锌械泻邪褉薪褟
instellen	薪邪谢邪褕褌芯胁褍胁邪褌懈, 胁褋褌邪薪芯胁谢褞胁邪褌懈
verscheuren	褉芯蟹写懈褉邪褌懈, 褕屑邪褌褍胁邪褌懈
fouilleren	芯斜褕褍泻褍胁邪褌懈
bars	褋褍胁芯褉懈泄, 褉褨蟹泻懈泄
planken	写芯褖邪薪懈泄
opkijken	锌褨写胁芯写懈褌懈 芯褔褨
het behoud	蟹斜械褉械卸械薪薪褟
de hendel	胁邪卸褨谢褜
schikken	褍锌芯褉褟写泻芯胁褍胁邪褌懈, 胁谢邪褕褌芯胁褍胁邪褌懈
de motorkap	泻邪锌芯褌
afspelen	锌褉芯谐褉邪胁邪褌懈, 胁褨写褌胁芯褉褞胁邪褌懈
de sirene	褋懈褉械薪邪
onbewust	薪械褋胁褨写芯屑芯
lazarus	褍 写懈屑 锌'褟薪懈泄
hardlopen	斜褨谐邪褌懈
hiertoe	写谢褟 褑褜芯谐芯, 写芯褋褨
verhinderen	锌械褉械褕泻芯写卸邪褌懈
de tolk	锌械褉械泻谢邪写邪褔 (褍褋薪懈泄)
de afbeelding	蟹芯斜褉邪卸械薪薪褟
de ziekenwagen	褕胁懈写泻邪 写芯锌芯屑芯谐邪
het telefoongesprek	褌械谢械褎芯薪薪邪 褉芯蟹屑芯胁邪
het laken	锌褉芯褋褌懈褉邪写谢芯; 褋褍泻薪芯
het foetus	锌谢褨写, 械屑斜褉褨芯薪
opleggen	薪邪泻谢邪写邪褌懈, 薪邪胁'褟蟹褍胁邪褌懈
aanraden	褉邪写懈褌懈
de voorruit	谢芯斜芯胁械 褋泻谢芯
elektrisch	械谢械泻褌褉懈褔薪懈泄
de spoorweg	蟹邪谢褨蟹薪懈褑褟
cynisch	褑懈薪褨褔薪懈泄
betuigen	胁懈褋谢芯胁谢褞胁邪褌懈, 蟹邪褋胁褨写褔褍胁邪褌懈
overeenkomen	锌芯谐芯写卸褍胁邪褌懈褋褟, 蟹斜褨谐邪褌懈褋褟
het woordenboek	褋谢芯胁薪懈泻
gewezen	泻芯谢懈褕薪褨泄
het loer	锌褉懈屑邪薪泻邪
ge茂rriteerd	褉芯蟹写褉邪褌芯胁邪薪懈泄
de sofa	写懈胁邪薪
gunnen	薪械 褕泻芯写褍胁邪褌懈, 蟹懈褔懈褌懈
inschenken	薪邪谢懈胁邪褌懈
omarmen	芯斜褨泄屑邪褌懈
ondankbaar	薪械胁写褟褔薪懈泄
de tombe	谐褉芯斜薪懈褑褟
ondeugend	锌褍褋褌芯褌谢懈胁懈泄, 斜械褕泻械褌谢懈胁懈泄
lappen	谢邪褌邪褌懈; 褍锌芯褉邪褌懈褋褟
de petitie	锌械褌懈褑褨褟
de helling	褋褏懈谢, 褍褏懈谢
lozen	蟹谢懈胁邪褌懈, 褋泻懈写邪褌懈
verwaand	蟹邪褉芯蟹褍屑褨谢懈泄
ondermijnen	锌褨写褉懈胁邪褌懈, 锌褨写褌芯褔褍胁邪褌懈
de criminaliteit	蟹谢芯褔懈薪薪褨褋褌褜
plezierig	锌褉懈褦屑薪懈泄
de kennismaking	蟹薪邪泄芯屑褋褌胁芯
de slagroom	蟹斜懈褌褨 胁械褉褕泻懈
daarstraks	褖芯泄薪芯, 薪械写邪胁薪芯
de stewardess	褋褌褞邪褉写械褋邪
de haas	蟹邪褦褑褜
bekwaam	褍屑褨谢懈泄, 蟹写褨斜薪懈泄
ontvluchten	褌褨泻邪褌懈 胁褨写
de wasmachine	锌褉邪谢褜薪邪 屑邪褕懈薪邪
gerelateerd	锌芯胁'褟蟹邪薪懈泄
gedoopt	芯褏褉械褖械薪懈泄
afdoen	蟹薪褨屑邪褌懈; 锌褉懈屑械薪褕褍胁邪褌懈
gewaagd	褉懈蟹懈泻芯胁邪薪懈泄, 褋屑褨谢懈胁懈泄
verdwalen	蟹邪斜谢褍泻邪褌懈
het smeergeld	褏邪斜邪褉
verwennen	斜邪谢褍胁邪褌懈
inbegrepen	胁泻谢褞褔械薪懈泄
alsmaar	胁械褋褜 褔邪褋
kritisch	泻褉懈褌懈褔薪懈泄
duiden	褍泻邪蟹褍胁邪褌懈, 褌谢褍屑邪褔懈褌懈
experimenteren	械泻褋锌械褉懈屑械薪褌褍胁邪褌懈
de verhuizing	锌械褉械褩蟹写
onoverwinnelijk	薪械锌械褉械屑芯卸薪懈泄
de drop	泻褉邪锌谢褟; 谢芯泻褉懈褑褟
stabiliseren	褋褌邪斜褨谢褨蟹褍胁邪褌懈
bezwaren	芯斜褌褟卸褍胁邪褌懈
doorzetten	薪邪锌芯谢褟谐邪褌懈, 写芯胁芯写懈褌懈 写芯 泻褨薪褑褟
het volume	芯斜褋褟谐; 谐褍褔薪褨褋褌褜
contacteren	泻芯薪褌邪泻褌褍胁邪褌懈
ontnemen	胁褨写斜懈褉邪褌懈, 锌芯蟹斜邪胁谢褟褌懈
de moskee	屑械褔械褌褜
tweedehands	胁卸懈胁邪薪懈泄
oprapen	锌褨写斜懈褉邪褌懈 蟹 蟹械屑谢褨
ongeschikt	薪械锌褉懈写邪褌薪懈泄
aanmoedigen	锌褨写斜邪写褜芯褉褞胁邪褌懈, 蟹邪芯褏芯褔褍胁邪褌懈
opslaan	蟹斜械褉褨谐邪褌懈; 褋泻谢邪写褍胁邪褌懈
bleken	胁懈斜褨谢褞胁邪褌懈
vrijmaken	蟹胁褨谢褜薪褟褌懈
voltooien	蟹邪胁械褉褕褍胁邪褌懈
de scheidsrechter	褋褍写写褟 (褋锌芯褉褌懈胁薪懈泄)
de omgang	褋锌褨谢泻褍胁邪薪薪褟, 锌芯胁芯写卸械薪薪褟
de schatting	芯褑褨薪泻邪, 锌褉懈斜谢懈蟹薪懈泄 锌褨写褉邪褏褍薪芯泻
het voorjaar	胁械褋薪邪
imponeren	胁褉邪卸邪褌懈
de transformatie	锌械褉械褌胁芯褉械薪薪褟
meelopen	褨褌懈 锌芯褉褍褔, 褋褍锌褉芯胁芯写卸褍胁邪褌懈
eigenaardig	写懈胁邪泻褍胁邪褌懈泄, 褋胁芯褦褉褨写薪懈泄
snuffelen	薪褞褕懈褌懈, 胁懈褕褍泻褍胁邪褌懈
de dolfijn	写械谢褜褎褨薪
de oever	斜械褉械谐
het warenhuis	褍薪褨胁械褉屑邪谐
de binnenplaats	胁薪褍褌褉褨褕薪褨泄 写胁褨褉
de papegaai	锌邪锌褍谐邪
proper	褔懈褋褌懈泄, 芯褏邪泄薪懈泄
kogelvrij	泻褍谢械薪械锌褉芯斜懈胁薪懈泄
organisch	芯褉谐邪薪褨褔薪懈泄
rondrijden	褩蟹写懈褌懈 薪邪胁泻芯谢芯
linken	蟹胁'褟蟹褍胁邪褌懈, 锌芯胁'褟蟹褍胁邪褌懈
de schroevendraaier	胁懈泻褉褍褌泻邪
misbruiken	蟹谢芯胁卸懈胁邪褌懈
toveren	褔邪泻谢褍胁邪褌懈
abnormaal	薪械薪芯褉屑邪谢褜薪懈泄
strekken	锌褉芯褋褌褟谐邪褌懈, 褉芯蟹褌褟谐褍胁邪褌懈
bedreven	胁锌褉邪胁薪懈泄
de gezondheidszorg	芯褏芯褉芯薪邪 蟹写芯褉芯胁'褟
aarzelen	胁邪谐邪褌懈褋褟
onaardig	薪械写芯斜褉懈泄, 薪械锌褉懈褟蟹薪懈泄
erven	褍褋锌邪写泻芯胁褍胁邪褌懈
bedelen	卸械斜褉邪泻褍胁邪褌懈
de verdediger	蟹邪褏懈褋薪懈泻
pervers	蟹斜芯褔械薪懈泄
bereikbaar	写芯褋褟卸薪懈泄, 写芯褋褌褍锌薪懈泄
de kuil	褟屑邪
het onderscheid	胁褨写屑褨薪薪褨褋褌褜
de bushalte	邪胁褌芯斜褍褋薪邪 蟹褍锌懈薪泻邪
benoemen	锌褉懈蟹薪邪褔邪褌懈, 薪邪蟹懈胁邪褌懈
schenden	锌芯褉褍褕褍胁邪褌懈, 锌邪锌谢褞卸懈褌懈
toezien	薪邪谐谢褟写邪褌懈, 褋褌械卸懈褌懈
opeisen	胁懈屑邪谐邪褌懈, 斜褉邪褌懈 薪邪 褋械斜械 (胁褨写锌芯胁褨写邪谢褜薪褨褋褌褜)
onacceptabel	薪械锌褉懈泄薪褟褌薪懈泄
oplopen	写褨褋褌邪褌懈, 蟹邪蟹薪邪褌懈
verwarren	锌谢褍褌邪褌懈
het vooruitzicht	锌械褉褋锌械泻褌懈胁邪
gewoonweg	锌褉芯褋褌芯-褌邪泻懈
sarcastisch	褋邪褉泻邪褋褌懈褔薪懈泄
de amazone	胁械褉褕薪懈褑褟
verzwijgen	蟹邪屑芯胁褔褍胁邪褌懈
spannen	薪邪褌褟谐褍胁邪褌懈
meren	褕胁邪褉褌褍胁邪褌懈
onopvallend	薪械锌芯屑褨褌薪懈泄
magnetisch	屑邪谐薪褨褌薪懈泄
de schipper	褕泻褨锌械褉, 泻邪锌褨褌邪薪
de landbouw	褋褨谢褜褋褜泻械 谐芯褋锌芯写邪褉褋褌胁芯
indrukken	薪邪褌懈褋泻邪褌懈, 胁写邪胁谢褞胁邪褌懈
het kruispunt	锌械褉械褏褉械褋褌褟
bijkomen	锌褉懈褏芯写懈褌懈 写芯 褌褟屑懈
het cement	褑械屑械薪褌
kortom	泻芯褉芯褌褕械 泻邪卸褍褔懈
strafbaar	泻邪褉邪薪懈泄
geneigd	褋褏懈谢褜薪懈泄
visueel	胁褨蟹褍邪谢褜薪懈泄
irrelevant	薪械写芯褉械褔薪懈泄, 薪械褨褋褌芯褌薪懈泄
hoesten	泻邪褕谢褟褌懈
wegdoen	锌芯蟹斜褍胁邪褌懈褋褟, 锌褉懈斜懈褉邪褌懈
ongezien	薪械斜邪褔械薪懈泄, 薪械锌芯屑褨褔械薪懈泄
autorijden	泻械褉褍胁邪褌懈 邪胁褌芯屑芯斜褨谢械屑
combineren	锌芯褦写薪褍胁邪褌懈
strikken	蟹邪胁'褟蟹褍胁邪褌懈
psychisch	锌褋懈褏褨褔薪懈泄
tikken	褑芯泻邪褌懈, 褋褌褍泻邪褌懈
vervalsen	锌褨写褉芯斜谢褟褌懈
het buskruit	锌芯褉芯褏
de nevel	褌褍屑邪薪, 褋械褉锌邪薪芯泻
de financiering	褎褨薪邪薪褋褍胁邪薪薪褟
telefoneren	褌械谢械褎芯薪褍胁邪褌懈
bespelen	谐褉邪褌懈 (薪邪 褨薪褋褌褉褍屑械薪褌褨)
het gazon	谐邪蟹芯薪
merkwaardig	写懈胁薪懈泄, 锌褉懈屑褨褌薪懈泄
verzenden	薪邪写褋懈谢邪褌懈, 胁褨写锌褉邪胁谢褟褌懈
de verwoesting	褋锌褍褋褌芯褕械薪薪褟, 褉褍泄薪褍胁邪薪薪褟
ongesteld	褌芯泄, 褖芯 屑邪褦 屑褨褋褟褔薪褨; 薪械蟹写褍卸邪褦
de kinderkamer	写懈褌褟褔邪 泻褨屑薪邪褌邪
de cafetaria	泻邪褎械褌械褉褨泄
gassen	谐邪蟹褍胁邪褌懈, 褌懈褋薪褍褌懈 薪邪 谐邪蟹
de binnenstad	褑械薪褌褉 屑褨褋褌邪
stapelgek	谐械褌褜 斜芯卸械胁褨谢褜薪懈泄
de toonbank	锌褉懈谢邪胁芯泻
eeuwenlang	褋褌芯谢褨褌褌褟屑懈
ietsje	褌褉褨褕泻懈
zinvol	写芯褑褨谢褜薪懈泄, 芯褋屑懈褋谢械薪懈泄
oplichten	褋锌邪谢邪褏褍胁邪褌懈; 芯褕褍泻褍胁邪褌懈
thuisbrengen	胁褨写胁芯写懈褌懈 写芯写芯屑褍
de capaciteit	屑褨褋褌泻褨褋褌褜, 锌芯褌褍卸薪褨褋褌褜
neerstorten	锌邪写邪褌懈, 褉芯蟹斜懈胁邪褌懈褋褟
het priv茅leven	锌褉懈胁邪褌薪械 卸懈褌褌褟
vijandelijk	胁芯褉芯卸懈泄
forceren	褎芯褉褋褍胁邪褌懈, 蟹谢邪屑褍胁邪褌懈 褋懈谢芯褞
hoogstens	褖芯薪邪泄斜褨谢褜褕械
het onweer	谐褉芯蟹邪
de koek	锌懈褉褨谐, 锌械褔懈胁芯
eigenwijs	褍锌械褉褌懈泄, 褋邪屑芯胁锌械胁薪械薪懈泄
voldaan	蟹邪写芯胁芯谢械薪懈泄; 褋锌谢邪褔械薪懈泄
niettemin	锌褉芯褌械, 邪 胁褌褨屑
de schoonzus	蟹芯胁懈褑褟, 薪械胁褨褋褌泻邪
omkomen	谐懈薪褍褌懈
aanleggen	锌褉芯泻谢邪写邪褌懈, 芯斜谢邪褕褌芯胁褍胁邪褌懈
ontmantelen	写械屑芯薪褌褍胁邪褌懈, 褉芯蟹斜懈褉邪褌懈
de tiran	褌懈褉邪薪
sprakeloos	芯薪褨屑褨谢懈泄, 斜械蟹屑芯胁薪懈泄
spiritueel	写褍褏芯胁薪懈泄
opstarten	蟹邪锌褍褋泻邪褌懈
knipperen	斜谢懈屑邪褌懈, 泻谢褨锌邪褌懈
de kleermaker	泻褉邪胁械褑褜
de wekker	斜褍写懈谢褜薪懈泻
doorsnijden	褉芯蟹褉褨蟹邪褌懈
rubberen	谐褍屑芯胁懈泄
opsturen	薪邪写褋懈谢邪褌懈
erkend	胁懈蟹薪邪薪懈泄
reiken	褋褟谐邪褌懈, 锌褉芯褋褌褟谐邪褌懈褋褟
het fornuis	锌谢懈褌邪 (泻褍褏芯薪薪邪)
kwellen	屑褍褔懈褌懈, 泻邪褌褍胁邪褌懈
het rek	褋褌械谢邪卸, 锌芯谢懈褑褟
luidruchtig	谐邪谢邪褋谢懈胁懈泄
noordwaarts	薪邪 锌褨胁薪褨褔
spotten	谐谢褍蟹褍胁邪褌懈
wegrijden	胁褨写'褩卸写卸邪褌懈
gevat	写芯褌械锌薪懈泄
verzachten	锌芯屑'褟泻褕褍胁邪褌懈
slank	褋褌褉褍薪泻懈泄
onweerstaanbaar	褔邪褉褨胁薪懈泄, 薪械锌械褉械胁械褉褕械薪懈泄
de bovenkant	胁械褉褏
de buitenlander	褨薪芯蟹械屑械褑褜
slaperig	褋芯薪薪懈泄
wijlen	锌芯泻褨泄薪懈泄
godvergeten	蟹邪斜褍褌懈泄 斜芯谐芯屑
de drempel	锌芯褉褨谐
vergelijkbaar	锌芯褉褨胁薪褟薪薪懈泄
goor	斜褉懈写泻懈泄, 斜褉褍写薪懈泄
rondleiden	锌褉芯胁芯写懈褌懈 械泻褋泻褍褉褋褨褞
afvallen	胁褨写锌邪写邪褌懈; 褏褍写薪褍褌懈
verhuren	蟹写邪胁邪褌懈 胁 芯褉械薪写褍
doorgedraaid	蟹'褩褏邪胁褕懈泄 蟹 谐谢褍蟹写褍
masseren	屑邪褋邪卸褍胁邪褌懈
stimuleren	褋褌懈屑褍谢褞胁邪褌懈
luchten	锌褉芯胁褨褌褉褞胁邪褌懈
overwerken	锌褉邪褑褞胁邪褌懈 锌芯薪邪写薪芯褉屑芯胁芯
de schepping	褌胁芯褉褨薪薪褟
de zondaar	谐褉褨褕薪懈泻
de beek	褋褌褉褍屑芯泻
de ventilator	胁械薪褌懈谢褟褌芯褉
registreren	褉械褦褋褌褉褍胁邪褌懈
de juwelier	褞胁械谢褨褉
irriteren	写褉邪褌褍胁邪褌懈
het verbod	蟹邪斜芯褉芯薪邪
verknoeien	蟹褨锌褋褍胁邪褌懈, 蟹邪薪邪锌邪褋褌懈褌懈
de lantaarn	谢褨褏褌邪褉
uitsterven	胁懈屑懈褉邪褌懈
zuidelijk	锌褨胁写械薪薪懈泄
inspecteren	芯谐谢褟写邪褌懈, 褨薪褋锌械泻褌褍胁邪褌懈
kondigen	褋锌芯胁褨褖邪褌懈
rommelig	薪械芯褏邪泄薪懈泄, 斜械蟹谢邪写薪懈泄
klussen	锌褨写褉芯斜谢褟褌懈, 屑邪泄褋褌褉褍胁邪褌懈
sportief	褋锌芯褉褌懈胁薪懈泄
doodmoe	褋屑械褉褌械谢褜薪芯 胁褌芯屑谢械薪懈泄
zeiken	屑褉褟褔懈褌懈; 蟹邪薪褍写褋褌胁褍胁邪褌懈
uitsluitend	胁懈泻谢褞褔薪芯
de mascotte	褌邪谢褨褋屑邪薪
toetsen	锌械褉械胁褨褉褟褌懈, 胁懈锌褉芯斜芯胁褍胁邪褌懈
afschrikken	胁褨写谢褟泻褍胁邪褌懈
leunen	褋锌懈褉邪褌懈褋褟, 锌褉懈褌褍谢褟褌懈褋褟
ongevaarlijk	斜械蟹锌械褔薪懈泄
schadelijk	褕泻褨写谢懈胁懈泄
de consul	泻芯薪褋褍谢
tolereren	褌械褉锌褨褌懈, 褌芯谢械褉褍胁邪褌懈
overdoen	锌械褉械褉芯斜谢褟褌懈
zittend	褋懈写褟褔懈泄
reanimeren	褉械邪薪褨屑褍胁邪褌懈
twaalfde	写胁邪薪邪写褑褟褌懈泄
helderziend	褟褋薪芯胁懈写薪懈泄
onverantwoordelijk	斜械蟹胁褨写锌芯胁褨写邪谢褜薪懈泄
inspireren	薪邪写懈褏邪褌懈
traditioneel	褌褉邪写懈褑褨泄薪懈泄
de heerschappij	锌邪薪褍胁邪薪薪褟, 胁谢邪写邪褉褞胁邪薪薪褟
verlengen	锌褉芯写芯胁卸褍胁邪褌懈, 锌芯写芯胁卸褍胁邪褌懈
bedragen	褋褌邪薪芯胁懈褌懈 (褋褍屑褍)
binnenlopen	蟹邪褏芯写懈褌懈
gaar	蟹胁邪褉械薪懈泄, 谐芯褌芯胁懈泄
de sauna	褋邪褍薪邪
inschakelen	胁屑懈泻邪褌懈, 蟹邪谢褍褔邪褌懈
ietwat	写械褖芯
de uitvinder	胁懈薪邪褏褨写薪懈泻
liefdevol	谢褞斜谢褟褔懈泄, 薪褨卸薪懈泄
herhaaldelijk	薪械芯写薪芯褉邪蟹芯胁芯
witwassen	胁褨写屑懈胁邪褌懈 (谐褉芯褕褨)
onvolwassen	薪械蟹褉褨谢懈泄
opdringen	薪邪胁'褟蟹褍胁邪褌懈
de magistraat	屑邪谐褨褋褌褉邪褌, 褋褍写写褟
het organisme	芯褉谐邪薪褨蟹屑
rapen	蟹斜懈褉邪褌懈, 锌褨写斜懈褉邪褌懈
de vlakte	褉褨胁薪懈薪邪
onbereikbaar	薪械写芯褋褟卸薪懈泄
onaanvaardbaar	薪械锌褉懈泄薪褟褌薪懈泄
de droger	褋褍褕邪褉泻邪
stipt	锌褍薪泻褌褍邪谢褜薪懈泄, 褌芯褔薪懈泄
doodop	蟹芯胁褋褨屑 蟹薪械褋懈谢械薪懈泄
genereus	褖械写褉懈泄, 胁械谢懈泻芯写褍褕薪懈泄
beven	褌褉械屑褌褨褌懈
slingeren	褏懈褌邪褌懈, 褉芯蟹谐芯泄写褍胁邪褌懈
de pingu茂n	锌褨薪谐胁褨薪
teleurstellend	褉芯蟹褔邪褉芯胁褍褞褔懈泄
digitaal	褑懈褎褉芯胁懈泄
tactisch	褌邪泻褌懈褔薪懈泄
raadplegen	泻芯薪褋褍谢褜褌褍胁邪褌懈褋褟, 蟹胁褨褉褟褌懈褋褟
humeurig	锌褉懈屑褏谢懈胁懈泄, 褍 锌芯谐邪薪芯屑褍 薪邪褋褌褉芯褩
het telefoonboek	褌械谢械褎芯薪薪懈泄 写芯胁褨写薪懈泻
ginds	芯薪 褌邪屑
jaarlijks	褖芯褉褨褔薪懈泄
de meisjesnaam	写褨胁芯褔械 锌褉褨蟹胁懈褖械
doordringen	锌褉芯薪懈泻邪褌懈
verhullen	锌褉懈褏芯胁褍胁邪褌懈, 芯谐芯褉褌邪褌懈
opmerken	锌芯屑褨褔邪褌懈, 蟹邪褍胁邪卸褍胁邪褌懈
zogezegd	褌邪泻 斜懈 屑芯胁懈褌懈
infrarood	褨薪褎褉邪褔械褉胁芯薪懈泄
vrijgeven	芯锌褉懈谢褞写薪褞胁邪褌懈, 蟹胁褨谢褜薪褟褌懈
klaarkomen	写芯褋褟谐邪褌懈 芯褉谐邪蟹屑褍
bloeien	泻胁褨褌薪褍褌懈, 锌褉芯褑胁褨褌邪褌懈
dikwijls	褔邪褋褌芯
bedwingen	褋褌褉懈屑褍胁邪褌懈, 锌褉懈斜芯褉泻褍胁邪褌懈
geleidelijk	锌芯褋褌褍锌芯胁懈泄
de finish	褎褨薪褨褕
buitenlands	蟹邪泻芯褉写芯薪薪懈泄
achterkomen	写褨蟹薪邪胁邪褌懈褋褟, 蟹'褟褋芯胁褍胁邪褌懈
mank	泻褍谢褜谐邪胁懈泄
rommelen	谐褍褉泻芯褌褨褌懈; 锌芯褉锌邪褌懈褋褟
amusant	泻褍屑械写薪懈泄, 褉芯蟹胁邪卸邪谢褜薪懈泄
gekwalificeerd	泻胁邪谢褨褎褨泻芯胁邪薪懈泄
ompraten	褍屑芯胁谢褟褌懈, 锌械褉械泻芯薪褍胁邪褌懈
nietig	屑褨蟹械褉薪懈泄; 薪械写褨泄褋薪懈泄
de vrucht	锌谢褨写
de halsketting	薪邪屑懈褋褌芯
aanbrengen	褍褋褌邪薪芯胁谢褞胁邪褌懈, 薪邪薪芯褋懈褌懈
vrijkomen	蟹胁褨谢褜薪褟褌懈褋褟
compenseren	泻芯屑锌械薪褋褍胁邪褌懈
blijvend	褌褉懈胁邪谢懈泄, 锌芯褋褌褨泄薪懈泄
het sollicitatiegesprek	褋锌褨胁斜械褋褨写邪
bekrompen	胁褍蟹褜泻芯谢芯斜懈泄
de zeemeermin	褉褍褋邪谢泻邪
de tractor	褌褉邪泻褌芯褉
de ijsberg	邪泄褋斜械褉谐
driemaal	褌褉懈褔褨
de vergaderzaal	泻芯薪褎械褉械薪褑-蟹邪谢邪
verschonen	锌械褉械胁写褟谐邪褌懈, 屑褨薪褟褌懈 (斜褨谢懈蟹薪褍)
de afvoer	褋褌褨泻, 蟹谢懈胁
doven	谐邪褋懈褌懈
authentiek	邪胁褌械薪褌懈褔薪懈泄
onervaren	薪械写芯褋胁褨写褔械薪懈泄
zoveelste	泻芯褌褉懈泄 褍卸械, 褔械褉谐芯胁懈泄
onopgemerkt	薪械锌芯屑褨褔械薪懈泄
onderschatten	薪械写芯芯褑褨薪褞胁邪褌懈
blussen	谐邪褋懈褌懈 (胁芯谐芯薪褜)
uitwerken	芯锌褉邪褑褜芯胁褍胁邪褌懈, 褉芯蟹褉芯斜谢褟褌懈
haken	褔褨锌谢褟褌懈褋褟, 蟹邪褔褨锌邪褌懈
concurreren	泻芯薪泻褍褉褍胁邪褌懈
uitverkoren	芯斜褉邪薪懈泄
de dictator	写懈泻褌邪褌芯褉
promoten	锌褉芯褋褍胁邪褌懈, 褉械泻谢邪屑褍胁邪褌懈
reserveren	斜褉芯薪褞胁邪褌懈
de kameel	胁械褉斜谢褞写
de nadruk	薪邪谐芯谢芯褋, 邪泻褑械薪褌
het pension	锌邪薪褋褨芯薪
de afgevaardigde	写械谢械谐邪褌, 写械锌褍褌邪褌
zakendoen	胁械褋褌懈 褋锌褉邪胁懈
de pracht	锌懈褕薪芯褌邪, 褉芯蟹泻褨褕
kreupel	泻褍谢褜谐邪胁懈泄, 泻邪谢褨泻邪
gelijken	斜褍褌懈 褋褏芯卸懈屑
afstaan	锌芯褋褌褍锌邪褌懈褋褟, 胁褨写写邪胁邪褌懈
het mengsel	褋褍屑褨褕
bluffen	斜谢械褎褍胁邪褌懈
dolblij	薪械褋褌褟屑薪芯 褉邪写懈泄
ontroerd	蟹胁芯褉褍褕械薪懈泄
het echtpaar	锌芯写褉褍卸卸褟
wekenlang	褌懈卸薪褟屑懈
behoeden	芯斜械褉褨谐邪褌懈
noordelijk	锌褨胁薪褨褔薪懈泄
doorgronden	芯褋褟谐邪褌懈, 褉芯蟹谐邪写褍胁邪褌懈
de gemeenteraad	屑褨褋褜泻邪 褉邪写邪
de lunchtijd	芯斜褨写薪褟 锌械褉械褉胁邪
dwalen	斜谢褍泻邪褌懈
de overstroming	锌芯胁褨薪褜
gevoelloos	斜械蟹褔褍褌谢懈胁懈泄, 蟹邪褑褨锌械薪褨谢懈泄
opheffen	锌褨写薪褨屑邪褌懈; 褋泻邪褋芯胁褍胁邪褌懈
onveilig	薪械斜械蟹锌械褔薪懈泄
overtreffen	锌械褉械胁械褉褕褍胁邪褌懈
vlooien	胁懈谢芯胁谢褞胁邪褌懈 斜谢褨褏
het schoolhoofd	写懈褉械泻褌芯褉 褕泻芯谢懈
schaars	屑褨蟹械褉薪懈泄, 褉褨写泻褨褋薪懈泄
masturberen	屑邪褋褌褍褉斜褍胁邪褌懈
de eenhoorn	褦写懈薪芯褉褨谐
citeren	褑懈褌褍胁邪褌懈
heroverwegen	锌械褉械谐谢褟写邪褌懈 褉褨褕械薪薪褟
de omslag	芯斜泻谢邪写懈薪泻邪; 锌械褉械胁芯褉芯褌
demonstreren	写械屑芯薪褋褌褉褍胁邪褌懈
afzien	胁褨写屑芯胁谢褟褌懈褋褟, 蟹褉褨泻邪褌懈褋褟
overnieuw	薪邪薪芯胁芯
onterecht	薪械褋锌褉邪胁械写谢懈胁懈泄, 斜械蟹锌褨写褋褌邪胁薪懈泄
wijden	锌褉懈褋胁褟褔褍胁邪褌懈
putten	褔械褉锌邪褌懈
de tomaat	锌芯屑褨写芯褉
de ouderdom	褋褌邪褉褨褋褌褜, 胁褨泻
nucleair	褟写械褉薪懈泄
handmatig	褉褍褔薪懈泄
smal	胁褍蟹褜泻懈泄
afwerken	写芯褉芯斜谢褟褌懈, 蟹邪胁械褉褕褍胁邪褌懈
de kathedraal	褋芯斜芯褉
de installatie	褍褋褌邪薪芯胁泻邪, 屑芯薪褌邪卸
vrijgevig	褖械写褉懈泄
opvatten	褋锌褉懈泄屑邪褌懈, 褌谢褍屑邪褔懈褌懈
toedienen	褍胁芯写懈褌懈 (谢褨泻懈)
bevredigen	蟹邪写芯胁芯谢褜薪褟褌懈
telefonisch	褌械谢械褎芯薪芯屑
de arbeider	褉芯斜褨褌薪懈泻
mild	屑'褟泻懈泄, 谢邪谐褨写薪懈泄
beschikken	褉芯蟹锌芯褉褟写卸邪褌懈褋褟
weerzien	锌芯斜邪褔懈褌懈褋褟 蟹薪芯胁褍
het handvat	褉褍褔泻邪, 褉褍泻褨胁'褟
de melodie	屑械谢芯写褨褟
de stoofpot	褌褍褕泻芯胁邪薪邪 褋褌褉邪胁邪
spioneren	褕锌懈谐褍胁邪褌懈
de interpretatie	褌谢褍屑邪褔械薪薪褟
de koppeling	蟹褔械锌谢械薪薪褟
omleggen	锌械褉械泻谢邪写邪褌懈; 锌褉懈泻褨薪褔懈褌懈
hanteren	蟹邪褋褌芯褋芯胁褍胁邪褌懈, 芯褉褍写褍胁邪褌懈
fulltime	薪邪 锌芯胁薪褍 褋褌邪胁泻褍
zielsveel	斜械蟹屑械卸薪芯, 褍褋褨褦褞 写褍褕械褞
bijwonen	斜褍褌懈 锌褉懈褋褍褌薪褨屑, 胁褨写胁褨写褍胁邪褌懈
de westkust	蟹邪褏褨写薪械 褍蟹斜械褉械卸卸褟
opbergen	锌褉懈斜懈褉邪褌懈, 褋泻谢邪写邪褌懈
verduren	胁懈褌褉懈屑褍胁邪褌懈, 蟹薪芯褋懈褌懈
lollig	泻褍屑械写薪懈泄, 锌芯褌褨褕薪懈泄
de fysica	褎褨蟹懈泻邪
flexibel	谐薪褍褔泻懈泄
gehandicapt	蟹 褨薪胁邪谢褨写薪褨褋褌褞
afhouden	褋褌褉懈屑褍胁邪褌懈, 褍褌褉懈屑褍胁邪褌懈
dichtdoen	蟹邪褔懈薪褟褌懈
het kampvuur	斜邪谐邪褌褌褟
nijdig	褋械褉写懈褌懈泄, 谢褞褌懈泄
beveiligen	蟹邪褏懈褖邪褌懈, 褍斜械蟹锌械褔褍胁邪褌懈
verbijsterd	锌褉懈谐芯谢芯屑褕械薪懈泄
radioactief	褉邪写褨芯邪泻褌懈胁薪懈泄
acceptabel	锌褉懈泄薪褟褌薪懈泄
doodeng	褋褌褉邪褕械薪薪芯 屑芯褌芯褉芯褕薪懈泄
voortreffelijk	褔褍写芯胁懈泄, 写芯斜褨褉薪懈泄
binnenhalen	蟹邪薪芯褋懈褌懈, 蟹写芯斜褍胁邪褌懈
rampzalig	蟹谐褍斜薪懈泄, 泻邪褌邪褋褌褉芯褎褨褔薪懈泄
respectloos	薪械锌芯胁邪卸薪懈泄
vergezocht	薪邪写褍屑邪薪懈泄
mega	屑械谐邪, 胁械谢懈褔械蟹薪懈泄
gedetailleerd	写械褌邪谢褜薪懈泄
onwetend	薪械芯斜褨蟹薪邪薪懈泄, 薪械胁褨谐谢邪褋
de wasserette	锌褉邪谢褜薪褟 褋邪屑芯芯斜褋谢褍谐芯胁褍胁邪薪薪褟
desondanks	锌芯锌褉懈 褑械
de stofzuiger	锌懈谢芯褋芯褋
het avondmaal	胁械褔械褉褟
aanvankelijk	褋锌械褉褕褍, 褋锌芯褔邪褌泻褍
wenden	锌芯胁械褉褌邪褌懈, 蟹胁械褉褌邪褌懈褋褟
de kade	薪邪斜械褉械卸薪邪, 锌褉懈褔邪谢
voorleggen	锌芯写邪胁邪褌懈 薪邪 褉芯蟹谐谢褟写
trotseren	泻懈写邪褌懈 胁懈泻谢懈泻, 胁懈褌褉懈屑褍胁邪褌懈
de notaris	薪芯褌邪褉褨褍褋
het presidentschap	锌褉械蟹懈写械薪褌褋褌胁芯
heropenen	胁褨写泻褉懈胁邪褌懈 蟹薪芯胁褍
het gangpad	锌褉芯褏褨写
voorbarig	锌械褉械写褔邪褋薪懈泄
afhakken	胁褨写褉褍斜褍胁邪褌懈
instabiel	薪械褋褌邪斜褨谢褜薪懈泄
inkopen	蟹邪泻褍锌芯胁褍胁邪褌懈
spijbelen	锌褉芯谐褍谢褞胁邪褌懈 褕泻芯谢褍
gemeenschappelijk	褋锌褨谢褜薪懈泄
geavanceerd	锌械褉械写芯胁懈泄, 锌褉芯褋褍薪褍褌懈泄
piekeren	卸褍褉懈褌懈褋褟, 褋褍褕懈褌懈 谐芯谢芯胁褍
volbrengen	蟹胁械褉褕褍胁邪褌懈, 写芯胁芯写懈褌懈 写芯 泻褨薪褑褟
vatbaar	褋锌褉懈泄薪褟褌谢懈胁懈泄, 胁褉邪蟹谢懈胁懈泄
misgaan	褨褌懈 薪械 褌邪泻
uitermate	薪邪写蟹胁懈褔邪泄薪芯
de oppositie	芯锌芯蟹懈褑褨褟
het koord	褕薪褍褉, 泻邪薪邪褌
uitwisselen	芯斜屑褨薪褞胁邪褌懈褋褟
de asbak	锌芯锌褨谢褜薪懈褔泻邪
haastig	锌芯褋锌褨褕薪懈泄
plechtig	褍褉芯褔懈褋褌懈泄
samenstellen	褋泻谢邪写邪褌懈, 泻芯屑锌芯薪褍胁邪褌懈
de eetzaal	褩写邪谢褜薪褟 (蟹邪谢邪)
onmisbaar	薪械蟹邪屑褨薪薪懈泄
verteren	锌械褉械褌褉邪胁谢褞胁邪褌懈
het meubilair	屑械斜谢褨
de omheining	芯谐芯褉芯卸邪
weerzinwekkend	芯谐懈写薪懈泄, 胁褨写褉邪蟹谢懈胁懈泄
onbetaalbaar	薪械写芯褋褌褍锌薪懈泄 蟹邪 褑褨薪芯褞
sympathiek	褋懈屑锌邪褌懈褔薪懈泄, 锌褉懈褦屑薪懈泄
terechtkomen	芯锌懈薪褟褌懈褋褟, 锌褉懈蟹械屑谢褟褌懈褋褟
corrigeren	胁懈锌褉邪胁谢褟褌懈
terughoudend	褋褌褉懈屑邪薪懈泄
benutten	胁懈泻芯褉懈褋褌芯胁褍胁邪褌懈, 锌芯褋谢褍谐芯胁褍胁邪褌懈褋褟
vervagen	褉芯蟹屑懈胁邪褌懈褋褟, 褌褜屑褟薪褨褌懈
ziekelijk	褏胁芯褉芯斜谢懈胁懈泄
de uitbreiding	褉芯蟹褕懈褉械薪薪褟
de bankoverval	锌芯谐褉邪斜褍胁邪薪薪褟 斜邪薪泻褍
het gemeentehuis	屑械褉褨褟
schroeven	褍谐胁懈薪褔褍胁邪褌懈
tegenspreken	褋褍锌械褉械褔懈褌懈, 蟹邪锌械褉械褔褍胁邪褌懈
opwekken	蟹斜褍写卸褍胁邪褌懈, 胁懈褉芯斜谢褟褌懈
harteloos	斜械蟹褋械褉写械褔薪懈泄
doorwerken	锌褉邪褑褞胁邪褌懈 写邪谢褨
de gebruiker	泻芯褉懈褋褌褍胁邪褔
tussenbeide	锌芯屑褨卸, 褍褌褉褍褔邪褞褔懈褋褜
instemmen	锌芯谐芯写卸褍胁邪褌懈褋褟
ineen	写芯泻褍锌懈, 褉邪蟹芯屑
patrouilleren	锌邪褌褉褍谢褞胁邪褌懈
het oerwoud	锌褉邪谢褨褋褨, 写卸褍薪谐谢褨
flauwvallen	蟹薪械锌褉懈褌芯屑薪褨褌懈
herladen	锌械褉械蟹邪褉褟写卸邪褌懈
afschieten	蟹邪褋褌褉械谢懈褌懈
de mayonaise	屑邪泄芯薪械蟹
